{
  "$comment": "The first bed: it fades in UNDER the cue rather than replacing it.",
  "id": "cue:vignette-bed",
  "title": "Vignette",
  "file": "vignette-bed.wav",
  "role": "bed",
  "duration": 64.44,
  "loop": true,
  "mixDb": -9,
  "musical": {
    "key": "D minor",
    "bpm": 56,
    "notes": "One cello, close enough to hear the player breathing — the audio equivalent of the dossier's first-person voice. -9 dB so it sits under the stage cue instead of fighting it."
  },
  "provenance": {
    "tool": "Suno",
    "model": "v5.5",
    "prompt": "Instrumental bed, 56 BPM, D minor. One cello, close-miked, breathing and unhurried, with faint room tone around it. Nothing else at all. Extremely sparse — long notes, wide gaps, no vibrato display, no melody to follow. Sits underneath without competing for attention. Loops seamlessly.",
    "excludes": "piano, strings section, drums, vocals, melody, swell, ambient pad, reverb wash",
    "generatedAt": "2026-08-23",
    "licence": "Suno Pro plan, model v5.5: commercial use rights for songs made while subscribed (per the plan's terms as of August 2026). Generated by Dave Tashner for Sandtable."
  },
  "credit": "Music: “Vignette”, generated with Suno for Sandtable, 2026.",
  "notes": "Fades in under the stage cue when a first-person vignette has just appeared, and out again when the moment passes. The -9 dB trim is baked in at encode time by the pipeline, so the player sets one volume."
}
