{
  "$comment": "Cue C of the score. This chapter is about a document, not a battle.",
  "id": "cue:timetable",
  "title": "Timetable",
  "letter": "C",
  "file": "timetable.wav",
  "role": "cue",
  "duration": 93.52,
  "loop": true,
  "musical": {
    "key": "D dorian",
    "bpm": 60,
    "notes": "Machinery rather than mood — a plan admiring itself. Picks up the pizzicato ticking cue B hands over, so the pulse never stops between them."
  },
  "provenance": {
    "tool": "Suno",
    "prompt": "Instrumental underscore, 60 BPM, D dorian. A mechanical ostinato: low piano, pizzicato double basses and bowed vibraphone interlocking like clockwork being wound. Precise, cool and unemotional, closer to a study than a mood. The three-note figure passes between instruments without ever landing. Slight ritardando at the end, gears settling.",
    "excludes": "drums, vocals, strings section swell, brass, emotional, cinematic trailer, ambient pad",
    "generatedAt": "2026-08-23",
    "licence": "Suno Pro plan, model v5.5: commercial use rights for songs made while subscribed (per the plan's terms as of August 2026). Generated by Dave Tashner for Sandtable.",
    "model": "v5.5"
  },
  "credit": "Music: “Timetable”, generated with Suno for Sandtable, 2026.",
  "used_by": [
    "1914:origins"
  ],
  "notes": "The prologue chapter, origins of the plan. At 1:34 it is the shortest cue and loops most often — worth checking the loop point by ear."
}
