{
  "$comment": "Cue A of the score. The theme stated whole, before the campaign puts it under pressure.",
  "id": "cue:forty-days",
  "title": "The Clockwork Minute",
  "letter": "A",
  "file": "the-clockwork-minute.wav",
  "role": "cue",
  "duration": 139.2,
  "loop": true,
  "musical": {
    "key": "D minor",
    "bpm": 60,
    "notes": "60 BPM is one beat per simulated campaign hour at the timeline's default 1 h/s, so the score and the map keep the same time. States the three-note motif — up a minor third, down a step — whole and unhurried; every later cue has it under pressure."
  },
  "provenance": {
    "tool": "Suno",
    "prompt": "Instrumental underscore, 60 BPM, D minor. Solo upright piano with felt hammers and one sustained cello. A slow three-note figure — up a minor third, down a step — repeated like a clock. Distant low strings enter beneath it. Dry, close, small room, almost no reverb. No percussion. Patient and grave, not sad. Ends unresolved on an open fifth.",
    "excludes": "drums, percussion, vocals, choir, brass fanfare, orchestral swell, cinematic trailer, synth pad, EDM",
    "generatedAt": "2026-08-23",
    "licence": "Suno Pro plan, model v5.5: commercial use rights for songs made while subscribed (per the plan's terms as of August 2026). Generated by Dave Tashner for Sandtable.",
    "model": "v5.5"
  },
  "credit": "Music: “The Clockwork Minute”, generated with Suno for Sandtable, 2026.",
  "notes": "Opening sequence. The prompt is the one published in the cue sheet."
}
