{
  "$comment": "Cue F of the score. The only forward motion.",
  "id": "cue:the-turn",
  "title": "The Turn",
  "letter": "F",
  "file": "the-turn.wav",
  "role": "cue",
  "duration": 164.0,
  "loop": true,
  "musical": {
    "key": "D minor → F major",
    "bpm": 76,
    "notes": "The only cue in the score that moves forward, and even here it does not celebrate: this is relief, and the relief buys four more years. Should enter under the last held violin note of cue E, so the turn is felt before it is heard."
  },
  "provenance": {
    "tool": "Suno",
    "model": "v5.5",
    "prompt": "Instrumental underscore, 76 BPM, D minor leaning toward F major. Strings gather from a single line into a slow forward pulse; piano and harp beneath; the three-note figure inverted so that it rises instead of falling. Motion returning after long stillness — urgent, hopeful, but never triumphant. Ends mid-phrase, still climbing, unresolved.",
    "excludes": "fanfare, triumphant, heroic, choir, vocals, snare drum, epic trailer, drums",
    "generatedAt": "2026-08-23",
    "licence": "Suno Pro plan, model v5.5: commercial use rights for songs made while subscribed (per the plan's terms as of August 2026). Generated by Dave Tashner for Sandtable."
  },
  "credit": "Music: “The Turn”, generated with Suno for Sandtable, 2026.",
  "notes": "The Marne, 5–12 September. Hands off to cue G by refusing to arrive: cut the climb off and let the drone take the same pitch, so the listener notices the promise is not kept."
}
